Program, Director, Office, Contact
Industrial Electronics, John Smith, Room 101, john.smith@teccart.com
IT Management, Sarah Johnson, Room 102, sarah.johnson@teccart.com
Tele-Communications, Michael Chen, Room 103, michael.chen@teccart.com
Children Education, Emily Davis, Room 104, emily.davis@teccart.com
Fashion Design, Olivia Rodriguez, Room 105, olivia.rodriguez@teccart.com
Computer Support, Andrew Lee, Room 106, andrew.lee@teccart.com
Interior Design, Sophia Martinez, Room 107, sophia.martinez@teccart.com
